ID,overskrift,beskrivelse,progression
1,Afskaf fattigdom,"Afskaffelsen af alle former for fattigdom er fortsat en af de st칮rste udfordringer for menneskeheden. Mens antallet af mennesker, der lever i ekstrem fattigdom, er halveret - fra 1,9 milliarder i 1990 til 736 millioner i 2015 - k칝mper alt for mange stadig med at f친 opfyldt deres mest basale menneskelige behov.", 90
2,Stop sult,"Hurtig 칮konomisk v칝kst og 칮get landbrugsproduktivitet har i de seneste to 친rtier f친et andelen af underern칝rede mennesker i verden til at falde med n칝sten halvdelen. Mange udviklingslande, som tidligere led af hungersn칮d og sult, kan nu opfylde de mest s친rbare menneskers ern칝ringsm칝ssige behov. Central- og 칒stasien, Latinamerika og Caribien er regioner, der alle har gjort store fremskridt i udryddelsen af ekstrem hungersn칮d.", 80
3,Sundhed og trivsel,"Siden vedtagelsen af 2015-M친lene er der opn친et historiske resultater i reducering af b칮rned칮delighed, i forbedring af m칮dres sundhed og i bek칝mpelsen af HIV/AIDS, malaria og andre sygdomme.", 99
4,Kvalitetsuddannelse,"Siden 2000 er der sket enorme fremskridt i forhold til m친let om grundskoleuddannelse for alle. Den samlede indskrivningsrate i udviklingslande n친ede op p친 91 procent i 2015, og antallet af b칮rn, der dropper ud af skolen, er faldet med n칝sten halvdelen. Der har ogs친 v칝ret en dramatisk stigning i antallet af b칮rn, der kan l칝se, og der er flere piger i skole end nogensinde f칮r. Disse er alle bem칝rkelsesv칝rdige succeser.", 60
5,Ligestilling mellem k칮nnene,"Vi skal opn친 ligestilling mellem k칮nnene og styrke kvinders og pigers rettigheder og muligheder.", 102
6,Rent Vand og Sanitet,"Vandmangel p친virker mere end 40 procent af verdens befolkning. Det er et alarmerende tal, som  forventes at 칮ge med de stigende globale temperaturer for친rsaget af klima칝ndringerne.", 2000
7,B칝redygtig Energi,"Mellem 1990 og 2010 er antallet af personer med adgang til elektricitet steget med 1,7 milliarder, og da den globale befolkning forts칝tter med at stige, vil eftersp칮rgslen efter billig energi ogs친 blive st칮rre. En global 칮konomi, der er afh칝ngig af fossile br칝ndstoffer, og stigningen i udledningen af drivhusgasser skaber drastiske 칝ndringer i vores klimasystem. Det har en synlig effekt p친 alle kontinenter.", Ren fossil 游뚱游눧
